{
  "impact": {
    "affected_count": 10,
    "change_kinds": [
      "private_implementation"
    ],
    "classification_schema_version": "mncs.semantic-impact-classification/1",
    "complete": true,
    "cross_repository": {
      "complete": true,
      "coverage": {
        "classified_project_count": 0,
        "coverage_status": "not_requested",
        "explicit_nonparticipant_count": 0,
        "registered_family_project_count": 0,
        "registry_identity": "6c4b5a3fe947e69c1e08e0505c78652c386fd6ae08c9737bdd7907ed3536e3f1",
        "semantic_graph_participant_count": 0,
        "topology_status": "not_requested",
        "unclassified_project_count": 0,
        "unclassified_repositories": []
      },
      "edges": [],
      "graph_identity": "7be6180a4150615b9e75090e4db938d1cb86968ca82d8ef04aec77a9695ebc83",
      "limitations": [
        "cross-repository topology was not requested"
      ],
      "selected_repositories": []
    },
    "direct_dependents": [
      "mncs:0.2:operation:commons.pressure.lifecycle::pressure_lifecycle_status::entry::%24mncs%24call%240",
      "mncs:0.2:operation:commons.pressure.lifecycle::query_item::entry::%24mncs%24call%240",
      "mncs:0.2:program:commons.pressure.lifecycle"
    ],
    "graph_identity": "e992336a4c65ed7f0ffb95ae2d5d64f08f7fbcd18a81e6b33d99219a16cfdd5c",
    "guarantee_domains": [
      "semantic",
      "compiler",
      "runtime"
    ],
    "limitations": [
      "cross-repository edges and path-sensitive control flow are not represented",
      "neighborhood is compiler-exact only for the current semantic graph"
    ],
    "risk_flags": [],
    "roots": [
      "mncs:0.2:function:commons.pressure.lifecycle::pressure_lifecycle_projection"
    ],
    "test_identities": []
  },
  "plan_id": "060967a1bf83c5197c68f65bfc9d25bc44898282a2833952906fa76d58f03f0b",
  "proof": {
    "boundary": {
      "claimed_scope": "repository",
      "established": false,
      "executor": "mncs-test",
      "stop_condition": "repository_canonical_suite_pass"
    },
    "required_evidence": [
      "repository_canonical_suite_pass"
    ],
    "sufficient_to_stop": false
  },
  "provenance": {
    "compiler_impact_schema": "mncs.semantic-impact/1",
    "dependencies": {
      "contract_revision": "mncs.verification-plan/1",
      "family_graph_identity": "7be6180a4150615b9e75090e4db938d1cb86968ca82d8ef04aec77a9695ebc83",
      "inventory_subject_fingerprint": "cd7cbf8afa22ae14ab33fc38467cd58d7d8c7affd207998fa81f97eac8991759",
      "inventory_subject_identity": "mncs:0.2:program:commons.pressure.lifecycle",
      "selected_test_identities": [],
      "semantic_graph_identity": "e992336a4c65ed7f0ffb95ae2d5d64f08f7fbcd18a81e6b33d99219a16cfdd5c",
      "source_sha256": "073ceedf72e8581e49b5debf45dd618bd5cd0ee4cc036b9d02e2102f391ac835"
    },
    "policy": "bounded-impact-v1",
    "provider": "ravel.verification_policy"
  },
  "schema_version": "mncs.verification-plan/1",
  "selection": {
    "available_repository_count": 0,
    "available_test_count": 0,
    "coverage_classified_project_count": 0,
    "escalation_reasons": [
      "public_contract_changed",
      "direct_dependents_affected"
    ],
    "level": "repository_canonical",
    "registered_family_project_count": 0,
    "routing_scope": "local",
    "selected_repositories": [],
    "selected_test_identities": [],
    "semantic_graph_repository_count": 0,
    "unclassified_project_count": 0
  },
  "source": {
    "path": "/home/epi13/Documents/Projects/.worktrees/compiler-value-ssa-20260926/MNCS-Commons/src/mncs_commons/mesh/mncs/commons/pressure/lifecycle.mncs",
    "sha256": "073ceedf72e8581e49b5debf45dd618bd5cd0ee4cc036b9d02e2102f391ac835",
    "subject_fingerprint": "cd7cbf8afa22ae14ab33fc38467cd58d7d8c7affd207998fa81f97eac8991759",
    "subject_identity": "mncs:0.2:program:commons.pressure.lifecycle"
  }
}
